{
  "version": "people-landscape-crop-overrides-v1",
  "status": "active",
  "ordering": "tmdb-person-id-ascending",
  "recordCount": 129,
  "records": [
    {
      "stableKey": "person:4",
      "tmdbPersonId": 4,
      "canonicalName": "Carrie Fisher",
      "format": "landscape",
      "status": "active",
      "sourceProfilePath": "/of4yHmryKPy92eeskUQ7MRmjC3l.jpg",
      "sourceHash": "30ba1425386098e675919da7d15f03162a9ac8acaefa402534bf1c62caf824ee",
      "basePresetId": "people-landscape-cormorant-v1",
      "basePresetHash": "a94f863b9332332617355fd73265571dc9b3ccf055365674757d76ac2c48faad",
      "cropStrategy": "person-specific-source-bound-landscape-v1",
      "cropRectangle": {
        "left": 0,
        "top": 0,
        "width": 807,
        "height": 917
      },
      "cropScale": {
        "x": 0.736059,
        "y": 0.736096
      },
      "cropOffsetX": 504,
      "cropOffsetY": 0,
      "reason": "avoid-unintended-face-crop",
      "evidencePackage": "tools/people-seed/.work/people-later-actors-candidate/visual-audit",
      "approvedProofHash": "5c18caad65f1527b407d92da0275f04fa33fcdca44e1481cd5174e118173fbd6",
      "createdFromAuditVersion": "people-landscape-crop-audit-v1"
    },
    {
      "stableKey": "person:19",
      "tmdbPersonId": 19,
      "canonicalName": "Allison Janney",
      "format": "landscape",
      "status": "active",
      "sourceProfilePath": "/kSaSnQ9xU8eVNL0mTppab95dZA8.jpg",
      "sourceHash": "1ef2a6dba3523b3b128c38597f1206869b0470e53b44b53a735838cfdd44666f",
      "basePresetId": "people-landscape-cormorant-v1",
      "basePresetHash": "a94f863b9332332617355fd73265571dc9b3ccf055365674757d76ac2c48faad",
      "cropStrategy": "person-specific-source-bound-landscape-v1",
      "cropRectangle": {
        "left": 0,
        "top": 0,
        "width": 791,
        "height": 899
      },
      "cropScale": {
        "x": 0.750948,
        "y": 0.750834
      },
      "cropOffsetX": 504,
      "cropOffsetY": 0,
      "reason": "avoid-unintended-face-crop",
      "evidencePackage": "tools/people-seed/.work/people-initial-actors-candidate/landscape-crop-audit",
      "approvedProofHash": "83a6b5a610ba66475399bb84a4da66f24a11431a7ebe135a223b197021937d07",
      "createdFromAuditVersion": "people-landscape-crop-audit-v1"
    },
    {
      "stableKey": "person:48",
      "tmdbPersonId": 48,
      "canonicalName": "Sean Bean",
      "format": "landscape",
      "status": "active",
      "sourceProfilePath": "/kTjiABk3TJ3yI0Cto5RsvyT6V3o.jpg",
      "sourceHash": "9a362bc68dd11ba189b785f7641a5fffd8a96d08ced62c9f2589facbdae3cefc",
      "basePresetId": "people-landscape-cormorant-v1",
      "basePresetHash": "a94f863b9332332617355fd73265571dc9b3ccf055365674757d76ac2c48faad",
      "cropStrategy": "person-specific-source-bound-landscape-v1",
      "cropRectangle": {
        "left": 0,
        "top": 0,
        "width": 1200,
        "height": 1364
      },
      "cropScale": {
        "x": 0.495,
        "y": 0.494868
      },
      "cropOffsetX": 504,
      "cropOffsetY": 0,
      "reason": "avoid-unintended-face-crop",
      "evidencePackage": "tools/people-seed/.work/people-later-actors-candidate/visual-audit",
      "approvedProofHash": "be907765ab723752bf384320773b6f2dce267418da84bcab33b9490dbf0db77b",
      "createdFromAuditVersion": "people-landscape-crop-audit-v1"
    },
    {
      "stableKey": "person:85",
      "tmdbPersonId": 85,
      "canonicalName": "Johnny Depp",
      "format": "landscape",
      "status": "active",
      "sourceProfilePath": "/k2xt6EUxQDwYRKIyI4IBdZxfs8n.jpg",
      "sourceHash": "07f81da5cea66d0621940369952111f8f619642076fa344872cdf1999c1efa31",
      "basePresetId": "people-landscape-cormorant-v1",
      "basePresetHash": "a94f863b9332332617355fd73265571dc9b3ccf055365674757d76ac2c48faad",
      "cropStrategy": "person-specific-source-bound-landscape-v1",
      "cropRectangle": {
        "left": 0,
        "top": 0,
        "width": 1129,
        "height": 1283
      },
      "cropScale": {
        "x": 0.526129,
        "y": 0.526111
      },
      "cropOffsetX": 504,
      "cropOffsetY": 0,
      "reason": "avoid-unintended-face-crop",
      "evidencePackage": "tools/people-seed/.work/people-initial-actors-candidate/landscape-crop-audit",
      "approvedProofHash": "9f82a640c1fd78894ca52941c371b832e7a188759f11c83e40256170f93c1551",
      "createdFromAuditVersion": "people-landscape-crop-audit-v1"
    },
    {
      "stableKey": "person:103",
      "tmdbPersonId": 103,
      "canonicalName": "Mark Ruffalo",
      "format": "landscape",
      "status": "active",
      "sourceProfilePath": "/5GilHMOt5PAQh6rlUKZzGmaKEI7.jpg",
      "sourceHash": "e5cc5c1bb86d4ac32171352de236b74ab6a49b91d043f5c38bdc25e9c0611046",
      "basePresetId": "people-landscape-cormorant-v1",
      "basePresetHash": "a94f863b9332332617355fd73265571dc9b3ccf055365674757d76ac2c48faad",
      "cropStrategy": "person-specific-source-bound-landscape-v1",
      "cropRectangle": {
        "left": 0,
        "top": 0,
        "width": 800,
        "height": 909
      },
      "cropScale": {
        "x": 0.7425,
        "y": 0.742574
      },
      "cropOffsetX": 504,
      "cropOffsetY": 0,
      "reason": "avoid-unintended-face-crop",
      "evidencePackage": "tools/people-seed/.work/people-later-actors-candidate/visual-audit",
      "approvedProofHash": "4ffdbc8a736e6a091601f929df1f3f9a2841e68d3562c7775eaeb8aa3e81e4ee",
      "createdFromAuditVersion": "people-landscape-crop-audit-v1"
    },
    {
      "stableKey": "person:113",
      "tmdbPersonId": 113,
      "canonicalName": "Christopher Lee",
      "format": "landscape",
      "status": "active",
      "sourceProfilePath": "/dA26fBr3t7mKqjn3OYW6kbD1LXM.jpg",
      "sourceHash": "0261dac70ab7f45f4a297a41f51791fa992554808a2241433ced0b8916142350",
      "basePresetId": "people-landscape-cormorant-v1",
      "basePresetHash": "a94f863b9332332617355fd73265571dc9b3ccf055365674757d76ac2c48faad",
      "cropStrategy": "person-specific-source-bound-landscape-v1",
      "cropRectangle": {
        "left": 0,
        "top": 0,
        "width": 1460,
        "height": 1659
      },
      "cropScale": {
        "x": 0.406849,
        "y": 0.406872
      },
      "cropOffsetX": 504,
      "cropOffsetY": 0,
      "reason": "avoid-unintended-face-crop",
      "evidencePackage": "tools/people-seed/.work/people-initial-actors-candidate/landscape-crop-audit",
      "approvedProofHash": "90f315f8d76d7d3a604abbcad2cc6b8d35da9cbf985013fee222196458fb5c11",
      "createdFromAuditVersion": "people-landscape-crop-audit-v1"
    },
    {
      "stableKey": "person:114",
      "tmdbPersonId": 114,
      "canonicalName": "Orlando Bloom",
      "format": "landscape",
      "status": "active",
      "sourceProfilePath": "/lwQoA0qJTCZ6l2FH6PjmhRQjiaB.jpg",
      "sourceHash": "c262f16b26b7a28e6b2a49878f93450ce4913673d53be52d6fc73cf82ab0cfb8",
      "basePresetId": "people-landscape-cormorant-v1",
      "basePresetHash": "a94f863b9332332617355fd73265571dc9b3ccf055365674757d76ac2c48faad",
      "cropStrategy": "person-specific-source-bound-landscape-v1",
      "cropRectangle": {
        "left": 0,
        "top": 0,
        "width": 2000,
        "height": 2273
      },
      "cropScale": {
        "x": 0.297,
        "y": 0.296964
      },
      "cropOffsetX": 504,
      "cropOffsetY": 0,
      "reason": "avoid-unintended-face-crop",
      "evidencePackage": "tools/people-seed/.work/people-initial-actors-candidate/landscape-crop-audit",
      "approvedProofHash": "a344c1d1be6a8147c5e73fe609a2a8a6857ad0ab8d44225b30de446a298d619c",
      "createdFromAuditVersion": "people-landscape-crop-audit-v1"
    },
    {
      "stableKey": "person:116",
      "tmdbPersonId": 116,
      "canonicalName": "Keira Knightley",
      "format": "landscape",
      "status": "active",
      "sourceProfilePath": "/k69IOXdz8PAvaegAI8WYvQvyyUJ.jpg",
      "sourceHash": "30a946d45a43b77302f8be935aad97a3ecdc3affa2eae22afcec4c1319dc0c31",
      "basePresetId": "people-landscape-cormorant-v1",
      "basePresetHash": "a94f863b9332332617355fd73265571dc9b3ccf055365674757d76ac2c48faad",
      "cropStrategy": "person-specific-source-bound-landscape-v1",
      "cropRectangle": {
        "left": 0,
        "top": 0,
        "width": 1000,
        "height": 1136
      },
      "cropScale": {
        "x": 0.594,
        "y": 0.59419
      },
      "cropOffsetX": 504,
      "cropOffsetY": 0,
      "reason": "avoid-unintended-face-crop",
      "evidencePackage": "tools/people-seed/.work/people-initial-actors-candidate/landscape-crop-audit",
      "approvedProofHash": "6c98557fa4b63ea217cc7ef7aa5d16266ea82b48517646586c9909f2026a68f0",
      "createdFromAuditVersion": "people-landscape-crop-audit-v1"
    },
    {
      "stableKey": "person:118",
      "tmdbPersonId": 118,
      "canonicalName": "Geoffrey Rush",
      "format": "landscape",
      "status": "active",
      "sourceProfilePath": "/npXFjaFQzBNroCEPllGPTZ5IisA.jpg",
      "sourceHash": "2eb4240d17ac72f9a031f2b53faaac2732c0d59738ca5b1887e39379c088208b",
      "basePresetId": "people-landscape-cormorant-v1",
      "basePresetHash": "a94f863b9332332617355fd73265571dc9b3ccf055365674757d76ac2c48faad",
      "cropStrategy": "person-specific-source-bound-landscape-v1",
      "cropRectangle": {
        "left": 0,
        "top": 0,
        "width": 2000,
        "height": 2273
      },
      "cropScale": {
        "x": 0.297,
        "y": 0.296964
      },
      "cropOffsetX": 504,
      "cropOffsetY": 0,
      "reason": "avoid-unintended-face-crop",
      "evidencePackage": "tools/people-seed/.work/people-later-actors-candidate/visual-audit",
      "approvedProofHash": "02aa962e7a933c079f1a4236c2ac5e81a0bfbc0f81c74fe9a313f8aaf0df9e21",
      "createdFromAuditVersion": "people-landscape-crop-audit-v1"
    },
    {
      "stableKey": "person:131",
      "tmdbPersonId": 131,
      "canonicalName": "Jake Gyllenhaal",